ID	Label	Alternative Term	Definition	Parent Class
ID	A rdfs:label	A oboInOwl:hasExactSynonym	A IAO:0000115	SC %
MOLSIM:000214	femtosecond	fs	An SI unit of time equal to 10^-15 seconds or one quadrillionth of a second.	UO:1000010
MOLSIM:000215	atmosphere	atm	A unit of pressure defined as 101,325 pascals (Pa) or 1.01325 bar, approximately equal to the average atmospheric pressure at sea level on Earth.	UO:0000109
MOLSIM:000464	angstrom per nanosecond	Å/ns|angstrom/nanosecond	A unit of velocity, representing one angstrom (10^-10 meters) of distance traveled per nanosecond (10^-9 seconds) of time. It is commonly used in molecular dynamics simulations and studies of atomic-scale processes.	UO:0000060
MOLSIM:000485	kilocalorie per mole	kcal/mol|kilocalorie/mole	A unit of energy per amount of substance, defined as one kilocalorie of energy (1000 thermochemical gram calories) per one mole of substance. It is commonly used in chemistry and biology for thermodynamic quantities.	UO:0000111
MOLSIM:000486	kilocalorie per mole per square angstrom	kcal/mol/Å^2|kilocalorie/mole/angstrom^2	A unit of energy per amount of substance per area, commonly used in molecular dynamics simulations for expressing force constants and restraint weights.	UO:0000111
